{"schema_version":1,"mission_id":"mission_downgrade01","verified_at":"2026-08-10T12:01:00Z","verifier_depth":"standard","lenses":["grounding","proof"],"results":[{"candidate_id":"C3","verdict":"downgraded","final_grade":"partial","proof_gaps":["integration proof unavailable"],"adjudication":"available evidence supports only a partial grade"}]}
